{
    "bundle_version": 2,
    "run": {
        "engine_version": "0.2.0",
        "policy_version": "2",
        "framework_table_version": "5bfb119e1a00",
        "budget_tokens": 8000,
        "diff_sha": "364e9ed174d5",
        "repo_sha": null
    },
    "used_tokens": 299,
    "assertions": [
        {
            "id": "a36c2a3fcdbb7",
            "kind": "named_reference",
            "subject": "App\\Http\\Resources\\User\\UserResource",
            "reason": "the region depends on App\\Http\\Resources\\User\\UserResource, whose contract is defined in another file",
            "origin": {
                "path": "app/Http/Controllers/Admin/ProfileController.php",
                "lines": [
                    1,
                    55
                ]
            }
        },
        {
            "id": "a49bcdbae51f0",
            "kind": "unverifiable_premise",
            "subject": "surrounding-transaction",
            "reason": "the region performs several persistence writes; whether a transaction wraps them is decided by the caller, which the diff does not show",
            "origin": {
                "path": "app/Http/Controllers/Admin/ProfileController.php",
                "lines": [
                    1,
                    55
                ]
            }
        },
        {
            "id": "a09be31d870a7",
            "kind": "named_reference",
            "subject": "App\\Models\\User::where",
            "reason": "the region depends on App\\Models\\User::where, whose contract is defined in another file",
            "origin": {
                "path": "tests/Feature/ProfileTest.php",
                "lines": [
                    1,
                    130
                ]
            }
        },
        {
            "id": "adf99a084a629",
            "kind": "named_reference",
            "subject": "App\\Models\\User::factory",
            "reason": "the region depends on App\\Models\\User::factory, whose contract is defined in another file",
            "origin": {
                "path": "tests/Feature/ProfileTest.php",
                "lines": [
                    1,
                    130
                ]
            }
        }
    ],
    "items": [
        {
            "assertion_id": "a36c2a3fcdbb7",
            "lever": "fetched",
            "provenance": {
                "path": "app/Http/Resources/User/UserResource.php",
                "member": "toArray",
                "lines": [
                    10,
                    19
                ]
            },
            "payload": "    public function toArray(Request $request): array\n    {\n        return [\n            'id' => $this->id,\n            'name' => $this->name,\n            'email' => $this->email,\n            'role' => $this->role,\n            'created_at' => $this->created_at?->toIso8601String(),\n        ];\n    }",
            "tokens": 75
        },
        {
            "assertion_id": "a09be31d870a7",
            "lever": "fetched",
            "provenance": {
                "path": "app/Models/User.php",
                "member": "casts",
                "lines": [
                    40,
                    51
                ]
            },
            "payload": "    /**\n     * Get the attributes that should be cast.\n     *\n     * @return array<string, string>\n     */\n    protected function casts(): array\n    {\n        return [\n            'email_verified_at' => 'datetime',\n            'password' => 'hashed',\n        ];\n    }",
            "tokens": 67
        },
        {
            "assertion_id": "a09be31d870a7",
            "lever": "fetched",
            "provenance": {
                "path": "app/Models/User.php",
                "member": "fillable",
                "lines": [
                    18,
                    28
                ]
            },
            "payload": "    /**\n     * The attributes that are mass assignable.\n     *\n     * @var list<string>\n     */\n    protected $fillable = [\n        'name',\n        'email',\n        'password',\n        'role',\n    ];",
            "tokens": 50
        },
        {
            "assertion_id": "a09be31d870a7",
            "lever": "fetched",
            "provenance": {
                "path": "app/Models/User.php",
                "member": "hidden",
                "lines": [
                    30,
                    38
                ]
            },
            "payload": "    /**\n     * The attributes that should be hidden for serialization.\n     *\n     * @var list<string>\n     */\n    protected $hidden = [\n        'password',\n        'remember_token',\n    ];",
            "tokens": 48
        },
        {
            "assertion_id": "adf99a084a629",
            "lever": "flagged",
            "provenance": {
                "path": "tests/Feature/ProfileTest.php",
                "member": "App\\Models\\User::factory",
                "lines": [
                    1,
                    130
                ]
            },
            "payload": "ASSUMPTION: named reference could not be resolved on disk; contract unverified",
            "tokens": 20
        },
        {
            "assertion_id": "a09be31d870a7",
            "lever": "flagged",
            "provenance": {
                "path": "tests/Feature/ProfileTest.php",
                "member": "App\\Models\\User::where",
                "lines": [
                    1,
                    130
                ]
            },
            "payload": "ASSUMPTION: named reference could not be resolved on disk; contract unverified",
            "tokens": 20
        },
        {
            "assertion_id": "a49bcdbae51f0",
            "lever": "flagged",
            "provenance": {
                "path": "app/Http/Controllers/Admin/ProfileController.php",
                "lines": [
                    1,
                    55
                ]
            },
            "payload": "ASSUMPTION: this code assumes a surrounding transaction; caller not checked",
            "tokens": 19
        }
    ],
    "diagnostics": [],
    "dropped": []
}
